{
  "$schema": "https://json-schema.org/draft/2020-12/schema",
  "title": "Rubric",
  "type": "object",
  "required": ["rubric_id", "name", "version", "criteria"],
  "properties": {
    "rubric_id": { "type": "string" },
    "name": { "type": "string" },
    "version": { "type": "string" },
    "description": { "type": "string" },
    "criteria": {
      "type": "array",
      "minItems": 1,
      "items": {
        "type": "object",
        "required": ["id", "name", "description", "weight", "scale"],
        "properties": {
          "id": { "type": "string" },
          "name": { "type": "string" },
          "description": { "type": "string" },
          "weight": { "type": "number", "minimum": 0 },
          "scale": {
            "type": "object",
            "required": ["min", "max"],
            "properties": {
              "min": { "type": "integer" },
              "max": { "type": "integer" },
              "labels": {
                "type": "array",
                "items": { "type": "string" }
              }
            },
            "additionalProperties": false
          },
          "performance_levels": {
            "type": "array",
            "items": {
              "type": "object",
              "required": ["score", "descriptor"],
              "properties": {
                "score": { "type": "integer" },
                "descriptor": { "type": "string" },
                "anchor_examples": {
                  "type": "array",
                  "items": { "type": "string" }
                }
              },
              "additionalProperties": false
            }
          }
        },
        "additionalProperties": false
      }
    }
  },
  "additionalProperties": false}
